[
  {
    "schemaVersion": "1.0",
    "id": "SAMPLE-001",
    "sequence": 1,
    "risk": {
      "level": "high",
      "label": "높음",
      "rank": 70
    },
    "impact": {
      "level": "medium",
      "label": "보통",
      "rank": 50
    },
    "checker": {
      "code": "EXAMPLE_CHECKER",
      "name": "예시 체커",
      "category": "보안"
    },
    "language": "예시 언어",
    "location": {
      "reportedFile": "src/application/ExampleService.ext",
      "reportedLine": 42,
      "reportedFunction": "processInput"
    },
    "report": {
      "description": "보고서 검출 설명 예시입니다.",
      "detectedCode": "42. value.use()",
      "detectedAt": "2026-01-01T00:00:00Z",
      "section": "예시 절",
      "vendorAttributes": {
        "A.S": "N"
      }
    },
    "sourceMapping": {
      "status": "exact",
      "currentFile": "src/application/ExampleService.ext",
      "currentLine": 42,
      "currentFunction": "processInput",
      "evidence": "현재 소스에서 같은 연산과 데이터 흐름을 확인했습니다.",
      "fingerprint": "ExampleService.processInput:value.use"
    },
    "grouping": {
      "duplicateGroup": "",
      "workGroup": "WG-001",
      "conflictFiles": [
        "src/application/ExampleService.ext"
      ],
      "relatedIds": []
    },
    "suggestedConclusion": "needs-review",
    "suggestedReason": "소스는 일치하지만 입력의 필수 여부는 아직 확인하지 못했습니다.",
    "policyDependencies": [
      "input-null-policy"
    ]
  }
]
